{
  "$schema": "./standard_manifest.schema.json",
  "standardId": "das-standard",
  "standardVersion": "1.4.0",
  "releasedAt": "2026-04-06",
  "docTypes": [
    "master_doc",
    "prd",
    "ui_spec",
    "headless_surface_note",
    "module_doc",
    "runbook",
    "deployment_doc",
    "context_pack",
    "support_note",
    "normative_addendum"
  ],
  "enums": {
    "conformanceProfiles": [
      "L0",
      "L1",
      "L2"
    ],
    "interactionProfiles": [
      "standard_ui",
      "headless",
      "hfvi_canvas_webgl_game"
    ],
    "docStatuses": [
      "draft",
      "active",
      "frozen",
      "deprecated"
    ],
    "gateCadences": [
      "pr_blocking",
      "merge_to_main",
      "nightly",
      "pre_release",
      "adoption_migration"
    ],
    "gateEnforcementClasses": [
      "report_only",
      "blocking",
      "source_of_truth"
    ],
    "docFamilyRoles": [
      "canonical_entrypoint",
      "subordinate_doc",
      "module_doc"
    ],
    "moduleKinds": [
      "package",
      "library",
      "worker",
      "service",
      "infra_module",
      "tooling_module",
      "generator",
      "policy_pack",
      "other"
    ],
    "addendumKinds": [
      "deployment",
      "governance",
      "security",
      "other"
    ],
    "determinismValues": [
      "tier0",
      "tier1",
      "tier2",
      "not_applicable"
    ],
    "repoRoles": [
      "standard_repo",
      "suite_repo",
      "factory_repo",
      "verify_runtime_repo",
      "policy_pack_repo",
      "control_plane_repo",
      "enterprise_subtree_repo",
      "product_repo",
      "monorepo_local_tooling",
      "collaboration_enhancement_repo"
    ],
    "toolClasses": [
      "repo_audit",
      "repo_mutation",
      "contract_validation",
      "verify_runtime",
      "policy_pack",
      "suite_orchestration",
      "control_plane",
      "enterprise_modelops",
      "monorepo_local_guard",
      "migration_upgrade",
      "other"
    ],
    "toolPlacementTargets": [
      "standard_repo",
      "suite_repo",
      "factory_repo",
      "verify_runtime_repo",
      "policy_pack_repo",
      "control_plane_repo",
      "enterprise_subtree_repo",
      "product_repo",
      "monorepo_local_tooling",
      "repo_local_only"
    ],
    "verifyGateKinds": [
      "docs_meta",
      "contracts",
      "unit",
      "assembly",
      "integration",
      "api_e2e",
      "ui_e2e",
      "replay",
      "eval",
      "drift_audit",
      "migration_adoption",
      "other"
    ],
    "moduleStates": [
      "missing",
      "present_locked_match",
      "present_locked_mismatch",
      "present_local_override",
      "dirty"
    ],
    "releaseSnapshotKinds": [
      "standard_release_bundle",
      "factory_seed_snapshot",
      "policy_pack_snapshot",
      "suite_snapshot",
      "repo_local_mirror"
    ],
    "verifyReportOutcomes": [
      "pass",
      "fail",
      "error",
      "skipped",
      "not_run"
    ]
  },
  "interactionProfiles": [
    "standard_ui",
    "headless",
    "hfvi_canvas_webgl_game"
  ],
  "gateCadences": [
    "pr_blocking",
    "merge_to_main",
    "nightly",
    "pre_release",
    "adoption_migration"
  ],
  "requiredDocMetadata": {
    "master_doc": [
      "Doc ID",
      "Owner",
      "Status",
      "Governing standard",
      "Conformance profile",
      "Interaction profile",
      "Last updated",
      "Scope",
      "Doc family role"
    ],
    "prd": [
      "Doc ID",
      "Owner",
      "Status",
      "Governing standard",
      "Last updated",
      "Scope",
      "Parent Master Doc"
    ],
    "ui_spec": [
      "Doc ID",
      "Owner",
      "Status",
      "Governing standard",
      "Last updated",
      "Scope",
      "Parent Master Doc",
      "Interaction profile"
    ],
    "headless_surface_note": [
      "Doc ID",
      "Owner",
      "Status",
      "Governing standard",
      "Last updated",
      "Scope",
      "Parent Master Doc",
      "Interaction profile"
    ],
    "module_doc": [
      "Doc ID",
      "Owner",
      "Status",
      "Governing standard",
      "Last updated",
      "Scope",
      "Parent Master Doc",
      "Doc family role",
      "Module kind"
    ],
    "runbook": [
      "Doc ID",
      "Owner",
      "Status",
      "Governing standard",
      "Last updated",
      "Scope",
      "Parent Master Doc"
    ],
    "deployment_doc": [
      "Doc ID",
      "Owner",
      "Status",
      "Governing standard",
      "Last updated",
      "Scope",
      "Parent Master Doc"
    ],
    "context_pack": [
      "Doc ID",
      "Owner",
      "Status",
      "Governing standard",
      "Last updated",
      "Scope",
      "Parent Master Doc"
    ],
    "support_note": [
      "Doc ID",
      "Owner",
      "Status",
      "Governing standard",
      "Last updated",
      "Scope",
      "Parent Master Doc"
    ],
    "normative_addendum": [
      "Doc ID",
      "Owner",
      "Status",
      "Governing standard",
      "Last updated",
      "Scope",
      "Parent standard",
      "Doc family role",
      "Addendum kind"
    ]
  },
  "requiredSections": {
    "master_doc": [
      "Document Control",
      "Contracts",
      "Contract inventory index",
      "Traceability index",
      "AI Execution Plan"
    ],
    "prd": [
      "Goals and non-goals",
      "Workflows",
      "Acceptance criteria"
    ],
    "ui_spec": [
      "0. Purpose and scope",
      "2. Screen inventory",
      "3. Workflow-to-screen maps",
      "4. Per-screen specification",
      "7. Test plan mapping"
    ],
    "headless_surface_note": [
      "Why there is no screen inventory",
      "Operator surface",
      "API / machine-facing surfaces",
      "Runtime surfaces",
      "Verification"
    ],
    "module_doc": [
      "Public entrypoints",
      "Contracts owned / consumed",
      "Verify",
      "Determinism"
    ],
    "runbook": [
      "Trigger / when to use",
      "Preconditions",
      "Steps",
      "Rollback / escalation"
    ],
    "deployment_doc": [
      "Environments",
      "Artifact identity",
      "Rollout",
      "Rollback / migrations"
    ],
    "context_pack": [
      "Glossary",
      "Invariants",
      "Verify",
      "Current tasks / focus"
    ],
    "support_note": [
      "Audience / handoff",
      "Evidence scope",
      "Redaction / export behavior",
      "Steps / next actions"
    ],
    "normative_addendum": [
      "Normative language",
      "Purpose and scope",
      "Relationship to the main standard"
    ]
  },
  "normativeArtifactRefs": {
    "specification": "SPECIFICATION.md",
    "changelog": "CHANGELOG.md",
    "appendixC": "appendices/appendix-c-project-master-doc-template.md",
    "appendixD": "appendices/appendix-d-ui-spec-appendix-template.md",
    "appendixL": "appendices/appendix-l-tooling-standard.md",
    "appendixM": "appendices/appendix-m-doc-family-governance-and-module-doc-templates.md",
    "standardManifestSchema": "standard_manifest.schema.json",
    "suiteVersionClosureSchema": "suite_version_closure.schema.json",
    "toolingLockSchema": "tooling_lock.schema.json",
    "localExtensionManifestSchema": "local_extension_manifest.schema.json",
    "appendixE": "appendices/appendix-e-multi-repo-contract-driven-standard.md",
    "appendixF": "appendices/appendix-f-sdmm-refactoring-migration-playbook.md",
    "appendixG": "appendices/appendix-g-ai-product-engineering-principles-addendum.md",
    "appendixH": "appendices/appendix-h-ui-design-review-checklist.md",
    "appendixI": "appendices/appendix-i-ddd-playbook.md",
    "appendixJ": "appendices/appendix-j-bdd-scenarios-verification-playbook.md",
    "appendixK": "appendices/appendix-k-hfvi-vis-template.md",
    "deploymentAddendum": "DAS_DEPLOYMENT_ADDENDUM.md",
    "governanceAddendum": "DAS_GOVERNANCE_COLLABORATION.md",
    "standardContextPack": "DAS_STANDARD_CONTEXT_PACK.md",
    "templateCatalog": "template_catalog.json",
    "templateCatalogSchema": "template_catalog.schema.json",
    "suiteLockSchema": "suite_lock.schema.json",
    "verifyRegistrySchema": "verify_registry.schema.json",
    "verifyReportSchema": "verify_report.schema.json",
    "releaseSnapshotManifestSchema": "release_snapshot_manifest.schema.json",
    "verifyRegistry": "verify_registry.json",
    "releaseSnapshotManifest": "release_snapshot_manifest.json",
    "appendixN": "appendices/appendix-n-repo-roles-tooling-placement-and-execution-matrix.md",
    "versionFile": "VERSION",
    "rootVerifyScript": "scripts/verify",
    "rootCIWorkflow": ".github/workflows/verify.yml"
  },
  "requiredArtifacts": [
    "SPECIFICATION.md",
    "CHANGELOG.md",
    "DAS_DEPLOYMENT_ADDENDUM.md",
    "DAS_GOVERNANCE_COLLABORATION.md",
    "DAS_STANDARD_CONTEXT_PACK.md",
    "standard_manifest.json",
    "standard_manifest.schema.json",
    "suite_version_closure.schema.json",
    "tooling_lock.schema.json",
    "local_extension_manifest.schema.json",
    "appendices/appendix-c-project-master-doc-template.md",
    "appendices/appendix-d-ui-spec-appendix-template.md",
    "appendices/appendix-e-multi-repo-contract-driven-standard.md",
    "appendices/appendix-f-sdmm-refactoring-migration-playbook.md",
    "appendices/appendix-g-ai-product-engineering-principles-addendum.md",
    "appendices/appendix-h-ui-design-review-checklist.md",
    "appendices/appendix-i-ddd-playbook.md",
    "appendices/appendix-j-bdd-scenarios-verification-playbook.md",
    "appendices/appendix-k-hfvi-vis-template.md",
    "appendices/appendix-l-tooling-standard.md",
    "appendices/appendix-m-doc-family-governance-and-module-doc-templates.md",
    "suite_version_closure.example.json",
    "tooling_lock.example.json",
    "local_extension_manifest.example.json",
    "template_catalog.json",
    "template_catalog.schema.json",
    "VERSION",
    "scripts/verify",
    ".github/workflows/verify.yml",
    "suite_lock.schema.json",
    "verify_registry.schema.json",
    "verify_report.schema.json",